"","Intercept::Est","Intercept::SE","Intercept::t.val","Experiment3:Est","Experiment3:SE","Experiment3:t.val","GroupsY:Est","GroupsY:SE","GroupsY:t.val","(Intercept):pval","Experiment3:pval","GroupsY:pval","(Intercept):pval.padj","Experiment3:pval.padj","GroupsY:pval.padj","Pathway"
"PWY-7094: fatty acid salvage",-6.82951083183914,1.30443829305513,-5.32284948158272,-0.922842369643791,1.55634817859749,-0.642601010048448,-0.551047787700816,1.54990364499986,-0.379566104606219,0.000220926203745126,0.561496354672006,0.674633047895869,0.0609512043040571,0.996248563114202,1,"PWY-7094: fatty acid salvage"
"PWY-7111: pyruvate fermentation to isobutanol (engineered)",10.5439761958208,0.216107657825583,48.8752302436332,-1.58513724407739,0.257841832326216,-6.15855560984536,0.068805309295086,0.256774159697333,0.269266601840734,2.57781682617836e-21,7.99209172966213e-06,0.79084260920087,9.83661491197809e-19,0.00288591056521959,1,"PWY-7111: pyruvate fermentation to isobutanol (engineered)"
"PWY-7115: C4 photosynthetic carbon assimilation cycle, NAD-ME type",0.471370248655832,2.10026365916279,0.24781250336611,-4.81481477458967,2.50586136417139,-1.93776324206492,-3.28508783756298,2.49548508206789,-1.33240727942241,0.787278653706971,0.0904838343436254,0.230805160553298,1,1,1,"PWY-7115: C4 photosynthetic carbon assimilation cycle, NAD-ME type"
"PWY-7117: C4 photosynthetic carbon assimilation cycle, PEPCK type",4.92708439226988,1.23293549905327,4.10159169806769,-0.0189866196332792,1.47103694248775,-0.00417133629900787,-2.88168757757946,1.46494566604358,-1.98353842087276,0.00169672525556891,0.926637659658368,0.0631472376152419,0.289711298524797,1,1,"PWY-7117: C4 photosynthetic carbon assimilation cycle, PEPCK type"
"PWY-7184: pyrimidine deoxyribonucleotides de novo biosynthesis I",8.13420066677808,0.314643369016079,25.8762430489592,-0.699435650820996,0.375406515496443,-1.86482731692898,-0.224357658642667,0.373852030494208,-0.600541565159017,3.32009261887831e-16,0.0799814497666356,0.55840958928721,1.1378882240346e-13,1,1,"PWY-7184: pyrimidine deoxyribonucleotides de novo biosynthesis I"
"PWY-7187: pyrimidine deoxyribonucleotides de novo biosynthesis II",8.19335586833624,0.719973900795709,12.781426558223,-16.3711939128376,0.859013473544033,-21.1586157799269,0.345737894756681,0.855456466656243,0.449649933424602,2.62558271249329e-05,2.92706601602577e-07,0.617673362921149,0.00683546597583826,0.000103618738675617,1,"PWY-7187: pyrimidine deoxyribonucleotides de novo biosynthesis II"
"PWY-7196: superpathway of pyrimidine ribonucleosides salvage",-6.63728599521447,1.45767556239367,-4.58245801965382,-1.21275044613149,1.7391782490562,-0.740571943529339,-0.682491380815066,1.73197665187348,-0.444413159855319,0.000670831712703733,0.526047155212004,0.648245928688583,0.134771849729899,1,1,"PWY-7196: superpathway of pyrimidine ribonucleosides salvage"
"PWY-7197: pyrimidine deoxyribonucleotide phosphorylation",7.3431354970149,0.252094015544659,29.1734544621198,0.975440178218524,0.300777786129955,3.24751311045358,0.256802010709508,0.299532324108801,0.858886973478127,3.98260418277183e-17,0.00463919662431032,0.407054133783305,1.39523257521514e-14,0.947124566281096,1,"PWY-7197: pyrimidine deoxyribonucleotide phosphorylation"
"PWY-7198: pyrimidine deoxyribonucleotides de novo biosynthesis IV",3.89356397267235,0.969931022170144,4.24828618988363,1.87984814885207,1.15724169380538,1.65935285822341,-0.621575139423691,1.15244978215035,-0.512230901288489,0.00393312550662228,0.117264995152006,0.617201277591375,0.31044019752337,1,1,"PWY-7198: pyrimidine deoxyribonucleotides de novo biosynthesis IV"
"PWY-7199: pyrimidine deoxyribonucleosides salvage",9.04707146337462,0.161336400987671,56.2186668757843,-0.349478887287688,0.192493286309884,-1.81993366900708,0.662135217514317,0.19169620923677,3.46346026553934,2.28995728628815e-22,0.0928654178923821,0.00330603090576411,9.05755015664767e-20,1,0.838595033126767,"PWY-7199: pyrimidine deoxyribonucleosides salvage"
"PWY-7208: superpathway of pyrimidine nucleobases salvage",8.19239239303839,0.247702913461396,33.1209077617798,0.733743862912163,0.295538685311076,2.48590395553833,0.189222747053965,0.294314917382359,0.644279729444412,3.67666316521928e-18,0.0239592953857792,0.532704029055278,1.31581927335546e-15,1,1,"PWY-7208: superpathway of pyrimidine nucleobases salvage"
"PWY-7209: superpathway of pyrimidine ribonucleosides degradation",-1.8009566861312,2.01442020362847,-0.879982492638241,-5.80695394685156,2.40344003356751,-2.44676458887744,0.686509499742925,2.39348785817436,0.289066414836429,0.41552131196018,0.0433802553602533,0.741692138421157,1,0.970732222763215,1,"PWY-7209: superpathway of pyrimidine ribonucleosides degradation"
"PWY-7210: pyrimidine deoxyribonucleotides biosynthesis from CTP",-7.09664525742704,1.58399052515679,-4.54474606488349,0.021913705600459,1.88988684391472,0.00951109153896573,0.21114849760127,1.88206119189879,0.126496182076489,0.00110935640432266,0.796905424241059,0.768662939751311,0.176405187963448,1,1,"PWY-7210: pyrimidine deoxyribonucleotides biosynthesis from CTP"
"PWY-7211: superpathway of pyrimidine deoxyribonucleotides de novo biosynthesis",-5.55857083186846,1.85226137698271,-3.00162705537352,-1.1631110328154,2.20996549679771,-0.542729409886982,-0.703481352649699,2.20081446164403,-0.328263088264384,0.0117949579607547,0.611072775073238,0.714316296101306,0.917341437758748,1,1,"PWY-7211: superpathway of pyrimidine deoxyribonucleotides de novo biosynthesis"
"PWY-7219: adenosine ribonucleotides de novo biosynthesis",10.1370545722008,0.710436990198327,15.8936913235354,-18.3028096256035,0.847634818442672,-23.8016739871527,0.380100534789741,0.844124928341541,0.531523352730421,3.00445385052299e-07,3.12384160205958e-10,0.595239525014737,8.2225777938903e-05,1.15364258717124e-07,0.998279735818756,"PWY-7219: adenosine ribonucleotides de novo biosynthesis"
"PWY-7220: adenosine deoxyribonucleotides de novo biosynthesis II",8.61246722939465,0.212035620304917,40.6992194805038,-0.195380426773092,0.252983413026346,-0.774277842529788,0.457553831646449,0.251935858162138,1.82063890789649,8.51073068592796e-20,0.456208321803729,0.0901144793471279,3.13479586820394e-17,1,1,"PWY-7220: adenosine deoxyribonucleotides de novo biosynthesis II"
"PWY-7221: guanosine ribonucleotides de novo biosynthesis",9.60307516682528,0.176794295133785,54.4842256353638,0.788337913250762,0.210936370607042,3.74809824101391,0.0351449616011383,0.210062924326812,0.168076736380733,4.03776535559692e-22,0.00169564473398737,0.849038427665491,1.59445083403613e-19,0.497027471184083,1,"PWY-7221: guanosine ribonucleotides de novo biosynthesis"
"PWY-7222: guanosine deoxyribonucleotides de novo biosynthesis II",8.61144615755255,0.212317309173227,40.6416572357695,-0.194980881278152,0.253319500949753,-0.771820924956589,0.459058503419046,0.252270554411147,1.82424638494943,8.73459731772812e-20,0.457703684516314,0.0896262364814605,3.21595442017961e-17,1,1,"PWY-7222: guanosine deoxyribonucleotides de novo biosynthesis II"
"PWY-7228: superpathway of guanosine nucleotides de novo biosynthesis I",8.40525083962736,0.237807765149355,35.4010419887062,0.774628116793736,0.283732610516746,2.73399993338359,0.21403465086727,0.28255772923609,0.75894180417938,1.08901868118671e-18,0.0143056507114326,0.463704088795629,3.94078269954029e-16,1,1,"PWY-7228: superpathway of guanosine nucleotides de novo biosynthesis I"
"PWY-7229: superpathway of adenosine nucleotides de novo biosynthesis I",9.30568466020981,0.182206881205081,51.2170746780189,0.395920910739019,0.217394221866402,1.82556102103134,0.316044713793805,0.216494034886384,1.46486695102589,1.28325826123528e-21,0.0903059742551823,0.169759657485454,4.95821214377374e-19,1,1,"PWY-7229: superpathway of adenosine nucleotides de novo biosynthesis I"
"PWY-7234: inosine-5'-phosphate biosynthesis III",7.59307202899637,0.271287007320335,28.0239671397354,1.26275117239323,0.323677280840394,3.9061122148921,0.0578702096663786,0.32233699648767,0.179448671851919,7.92100585650177e-17,0.00105350354409472,0.854622634802663,2.75003466592508e-14,0.33805429612661,1,"PWY-7234: inosine-5'-phosphate biosynthesis III"
"PWY-7237: myo-, chiro- and scillo-inositol degradation",7.24066981591584,0.764793979075707,10.5117195031744,-15.2987901327295,0.912489094098148,-18.3198313064906,-0.270538092265695,0.9087106551182,-0.365916916875215,5.42007510207755e-06,3.57881403331706e-10,0.644450087016653,0.00147851444772079,1.33179642829509e-07,1,"PWY-7237: myo-, chiro- and scillo-inositol degradation"
"PWY-7237: myo-, chiro- and scyllo-inositol degradation",-8.36732028471608,0.873229370496214,-10.3329874187141,14.4407832129917,1.04186525917342,15.1422161437988,0.223323657679591,1.03755109878227,0.19246190093318,1.00215812614754e-06,2.02996895931478e-09,0.685963059723583,0.000329284664422289,7.1876377316096e-07,1,"PWY-7237: myo-, chiro- and scyllo-inositol degradation"
"PWY-7238: sucrose biosynthesis II",-8.35094036447127,0.813194645088574,-10.8856167919788,17.1850915705082,0.970236776601092,18.8793930957827,0.675540851883788,0.966219215755488,0.799912993402098,3.01976207551721e-07,7.36102785628058e-11,0.511397985885754,0.000102189790998287,2.67328409777334e-08,0.991505291470292,"PWY-7238: sucrose biosynthesis II"
"PWY-7242: D-fructuronate degradation",5.8102630326624,0.369451660599389,15.743570117746,-0.39715475118119,0.440799248316286,-0.901363765977501,0.380458155726325,0.438973984789365,0.867168557957024,2.82452131810869e-12,0.381265406610379,0.399410243395693,8.86567500394005e-10,1,1,"PWY-7242: D-fructuronate degradation"
"PWY-724: superpathway of L-lysine, L-threonine and L-methionine biosynthesis II",8.80593757898737,0.156659417761121,56.4170848981675,0.0680892351403179,0.186913095690883,0.365468745304523,0.188327150237657,0.186139125096397,1.01579669462029,2.27148056654471e-22,0.722032370087361,0.338033268566488,9.04556379400302e-20,1,1,"PWY-724: superpathway of L-lysine, L-threonine and L-methionine biosynthesis II"
"PWY-7254: TCA cycle VII (acetate-producers)",-5.47649443446938,1.90997463270323,-2.87304899747104,-3.76890313342445,2.27882419321882,-1.69650967675931,4.41582349891427,2.26938802766265,1.97517799808752,0.0156808963824435,0.15470692475593,0.0967677986795708,0.9267775325986,1,1,"PWY-7254: TCA cycle VII (acetate-producers)"
"PWY-7282: 4-amino-2-methyl-5-diphosphomethylpyrimidine biosynthesis II",-10.892669898552,1.63526516119651,-6.82001488042431,7.66832775367634,1.95106351040291,4.06422577932984,5.92401762614646,1.94298453776889,3.13112909853886,1.69323871747982e-05,0.00472272554087145,0.0172153101434204,0.0053262326356955,0.403524891718733,0.811522545693861,"PWY-7282: 4-amino-2-methyl-5-diphosphomethylpyrimidine biosynthesis II"
"PWY-7282: 4-amino-2-methyl-5-phosphomethylpyrimidine biosynthesis (yeast)",-6.59552755665429,1.81992323184797,-3.64328518070704,-3.48995128056938,2.17138228933774,-1.64120038460894,3.90857605695712,2.16239101970453,1.83194487342283,0.0037687318391718,0.180419977651432,0.127842010648909,0.539230013047015,0.998224914469616,1,"PWY-7282: 4-amino-2-methyl-5-phosphomethylpyrimidine biosynthesis (yeast)"
"PWY-7312: dTDP-D-&beta;-fucofuranose biosynthesis",-6.82050587462566,1.38674896768255,-5.03520565716584,-0.910718294570811,1.65455448641409,-0.56236412307806,-0.723128617116742,1.64770329969158,-0.444538600539227,0.000419490444078189,0.589205248907691,0.632513156254816,0.092551357105718,1,1,"PWY-7312: dTDP-D-&beta;-fucofuranose biosynthesis"
"PWY-7315: dTDP-N-acetylthomosamine biosynthesis",6.01542213360692,1.37055379913664,4.57285261797548,-4.95142024297193,1.63523174711495,-3.07946402268407,2.8027903522981,1.62846057207899,1.73200924389642,0.0019908737299497,0.00737784597178955,0.100177572878936,0.217158287618435,0.980193302795521,1,"PWY-7315: dTDP-N-acetylthomosamine biosynthesis"
"PWY-7316: dTDP-N-acetylviosamine biosynthesis",-4.84662414652427,2.1161135333672,-2.29056465079016,3.49593174917025,2.5247721267428,1.40068659715335,0.361263178541528,2.51431753886786,0.139411671767123,0.0389775083336219,0.205893000209676,0.826434413376551,1,1,1,"PWY-7316: dTDP-N-acetylviosamine biosynthesis"
"PWY-7323: superpathway of GDP-mannose-derived O-antigen building blocks biosynthesis",5.48251509619088,0.240699016917718,22.8233739614954,0.537822641305731,0.287182213650536,1.87570423597834,0.392622756349353,0.285993048237576,1.37449404962731,4.07809622832501e-15,0.0801736388071578,0.191514930007873,1.35722685371668e-12,1,1,"PWY-7323: superpathway of GDP-mannose-derived O-antigen building blocks biosynthesis"
"PWY-7328: superpathway of UDP-glucose-derived O-antigen building blocks biosynthesis",-3.43689548563274,1.66193613635257,-2.05525609317904,11.9174776187716,1.98288511808382,6.10968996521397,-0.469927198767972,1.97467437839237,-0.235238060396914,0.0595822443129917,1.82096812264118e-05,0.781512507664882,1,0.00605865970247589,1,"PWY-7328: superpathway of UDP-glucose-derived O-antigen building blocks biosynthesis"
"PWY-7332: superpathway of UDP-N-acetylglucosamine-derived O-antigen building blocks biosynthesis",-0.306846054534722,1.88256242515671,-0.134127301328274,-7.37705488475713,2.24611820818795,-3.3325651738763,-1.10049508693784,2.23681747172295,-0.504799325239565,0.832352013298539,0.0073190684680853,0.628760654623747,1,0.782872456984522,1,"PWY-7332: superpathway of UDP-N-acetylglucosamine-derived O-antigen building blocks biosynthesis"
"PWY-7345: superpathway of anaerobic sucrose degradation",-7.5135847312548,1.87543729443262,-4.04587351679178,6.27337899239522,2.23761708990297,2.85617699321944,-0.897911857754844,2.22835155490713,-0.40982611663395,0.00155400736002276,0.0217040599536582,0.685322725874434,0.324319320711461,0.896863787244001,1,"PWY-7345: superpathway of anaerobic sucrose degradation"
"PWY-7356: thiamine diphosphate salvage IV (yeast)",-8.10552927323057,0.866258714302884,-10.2224777809443,13.6586174021052,1.03354844715719,14.6057354733312,0.171870091070622,1.02926872505896,0.166382821120379,8.59241315352872e-06,9.65986840294645e-08,0.695402201488545,0.00255985107963329,3.27130849540309e-05,1,"PWY-7356: thiamine diphosphate salvage IV (yeast)"
"PWY-7357: thiamin formation from pyrithiamine and oxythiamine (yeast)",7.11961553197483,0.729010852086666,10.8131450974247,-15.1966978425593,0.869795618438611,-19.1173172610114,0.029142664972646,0.866193964796333,0.0537799966353251,9.85129867022557e-07,7.59524179660964e-11,0.723399674705603,0.000273354301358458,2.82939024032897e-08,1,"PWY-7357: thiamin formation from pyrithiamine and oxythiamine (yeast)"
"PWY-7357: thiamine phosphate formation from pyrithiamine and oxythiamine (yeast)",-7.98648938261166,0.824226047602699,-10.3345340981945,15.6145456457364,0.983398536188833,17.1990979641936,0.10126983175931,0.979326475069426,0.0228458717346878,3.70041590907338e-07,1.02328568956389e-09,0.720530664083238,0.000125857979736316,3.60775449774705e-07,1,"PWY-7357: thiamine phosphate formation from pyrithiamine and oxythiamine (yeast)"
"PWY-7371: 1,4-dihydroxy-6-naphthoate biosynthesis II",-7.62072512707416,1.66550322544191,-4.60972712443315,0.91811505588975,1.98714107456459,0.472776665876797,1.31929520949421,1.97891271178924,0.676403339759509,0.000452836769633595,0.632613488097908,0.544249115297357,0.129618945081226,1,1,"PWY-7371: 1,4-dihydroxy-6-naphthoate biosynthesis II"
"PWY-7383: anaerobic energy metabolism (invertebrates, cytosol)",5.68887256210212,0.21752244035403,26.2092709580991,-0.107713126811301,0.259529834145071,-0.415558234821182,0.947100451786026,0.2584551718306,3.67110868442513,3.26136856209296e-16,0.687412401998646,0.00188769158552556,1.11400078058364e-13,1,0.676078555335427,"PWY-7383: anaerobic energy metabolism (invertebrates, cytosol)"
"PWY-7385: 1,3-propanediol biosynthesis (engineered)",-6.60204880098287,1.50229219858702,-4.45384870414745,-1.86758634076522,1.79241113929283,-1.09406182232809,0.702902970878531,1.78498911511676,0.400341759719494,0.00103034309732477,0.379678785113333,0.67256808571273,0.16795039894057,1,1,"PWY-7385: 1,3-propanediol biosynthesis (engineered)"
"PWY-7388: octanoyl-[acyl-carrier protein] biosynthesis (mitochondria, yeast)",0.516430718754607,1.57882922720614,0.362613327217448,-8.48584810091366,1.88372880891417,-4.62946145270539,-0.0993083455217775,1.87592865611751,-0.0390374228908642,0.710008976795762,0.00141583145092292,0.836774368458232,1,0.228608678322385,1,"PWY-7388: octanoyl-[acyl-carrier protein] biosynthesis (mitochondria, yeast)"
"PWY-7391: isoprene biosynthesis II (engineered)",-7.07333749931049,1.5415953251939,-4.64895901758614,1.80457007054667,1.83930438815977,1.01592370684249,-1.5985942226261,1.83168818820608,-0.911263011270539,0.000727483914210347,0.406159309530604,0.446597308535413,0.142739547628388,1,1,"PWY-7391: isoprene biosynthesis II (engineered)"
"PWY-7392: taxadiene biosynthesis (engineered)",-8.00389559277867,0.85241278128857,-10.0402095620007,15.6213193624116,1.01702862192472,16.6198199676029,-0.125828385049538,1.01281730519375,-0.14687666318483,2.5464084549686e-06,2.28955621753584e-09,0.703111713085837,0.000802452100858624,8.06950337425113e-07,1,"PWY-7392: taxadiene biosynthesis (engineered)"
"PWY-7400: L-arginine biosynthesis IV (archaebacteria)",9.89359817317659,0.185286085590355,53.5019453480705,-1.31180979069041,0.221068074559983,-5.945664503004,0.254329861109577,0.220152674874066,1.15871483079149,4.92999200049234e-22,1.30206933178743e-05,0.272560704660281,1.93822419075859e-19,0.00466617790618262,1,"PWY-7400: L-arginine biosynthesis IV (archaebacteria)"
"PWY-7456: &beta;-(1,4)-mannan degradation",-8.40908546432471,0.824595825432548,-11.0501041449189,15.1111330951423,0.983839724595395,16.7967700626281,0.707124689572544,0.979765836601033,0.803601083378329,6.27626033741779e-07,3.24214228174842e-09,0.513549118980949,0.000208891950159502,1.13622685220294e-06,0.999602755078745,"PWY-7456: &beta;-(1,4)-mannan degradation"
"PWY-7456: mannan degradation",5.35606181849212,0.780407185932128,7.58474326588614,-13.8366084196497,0.931117484710741,-16.1599807545608,0.463934352179139,0.927261909206444,0.524711994237119,0.000309933802256421,8.99191995515358e-09,0.589196200886242,0.0521205738560835,3.29289016660905e-06,1,"PWY-7456: mannan degradation"
"PWY-7539: 6-hydroxymethyl-dihydropterin diphosphate biosynthesis III (Chlamydia)",5.20983476503083,0.727821987221694,7.69693193808232,-13.5629696950659,0.868377162941675,-16.7493203591008,0.6287628424338,0.864781382846353,0.876833162312788,3.25384979833748e-05,6.36300772488552e-10,0.48451967336651,0.00862800220896423,2.36161765348325e-07,0.994611464544811,"PWY-7539: 6-hydroxymethyl-dihydropterin diphosphate biosynthesis III (Chlamydia)"
"PWY-7560: methylerythritol phosphate pathway II",-8.03213382661959,0.811460870799801,-10.6381725759553,17.1282890738042,0.968168180124895,19.2464500613171,0.301151833822366,0.964159184932963,0.277622143337977,1.39223517589375e-06,1.70468717409719e-09,0.678493540054643,0.000443945084001311,5.92744877396288e-07,1,"PWY-7560: methylerythritol phosphate pathway II"
"PWY-7616: methanol oxidation to carbon dioxide",-5.98109894212777,1.73907359559346,-3.45810716893482,0.609334786999944,2.07491917199834,0.294885769954353,-1.12562013170075,2.06632733727897,-0.578011631912773,0.00468438153029046,0.704952961660372,0.579141016202372,0.668589209766188,1,1,"PWY-7616: methanol oxidation to carbon dioxide"
"PWY-7663: gondoate biosynthesis (anaerobic)",8.55972035759443,0.171313753484345,50.116640249885,0.575335945583196,0.204397440356952,2.82256956877338,0.00386801816002167,0.203551070508763,0.0194376882328498,1.98102674489238e-21,0.0127533442367437,0.918481971286554,7.58069432587227e-19,0.996575526396886,1,"PWY-7663: gondoate biosynthesis (anaerobic)"
"PWY-7664: oleate biosynthesis IV (anaerobic)",2.59442678739937,2.06453503386719,1.28329618223637,-3.37125015429073,2.46323291543706,-1.3845720456597,-3.46773342328878,2.45303314940744,-1.41643897742656,0.238223375150032,0.208682624168524,0.192632986767446,1,1,1,"PWY-7664: oleate biosynthesis IV (anaerobic)"
"PWY-7688: dTDP-&alpha;-D-ravidosamine and dTDP-4-acetyl-&alpha;-D-ravidosamine biosynthesis",-8.70483111806727,1.74093978326488,-5.06867441208006,5.29758083165455,2.077145753201,2.61621822936214,1.49521310471627,2.06854469864408,0.736501310664671,0.000255950511984902,0.038779670080869,0.502975053189423,0.0745009711997166,0.921943125886856,1,"PWY-7688: dTDP-&alpha;-D-ravidosamine and dTDP-4-acetyl-&alpha;-D-ravidosamine biosynthesis"
"PWY-7761: NAD salvage pathway II (PNC IV cycle)",-7.8866504622013,0.924127570094661,-8.82619329860851,11.87899016828,1.10259279274912,11.2246510782072,-0.0784045045671939,1.09802717151148,-0.093428646171129,1.56855893916445e-06,6.78333392612704e-08,0.755690283945059,0.000517033921830709,2.34557460667124e-05,1,"PWY-7761: NAD salvage pathway II (PNC IV cycle)"
"PWY-7790: UMP biosynthesis II",-8.12917894341679,0.841085806316607,-10.363844595426,18.5193855669828,1.00351420965969,20.0406419801438,0.27271967241931,0.999358853468332,0.284988872944339,8.74398228148041e-07,2.71286813571873e-10,0.661517513499822,0.000292694020911999,9.65301135786035e-08,1,"PWY-7790: UMP biosynthesis II"
"PWY-7791: UMP biosynthesis III",-8.06340177822837,0.831244929217764,-10.5220156815243,18.4371033100466,0.991772886800553,20.4109606910025,0.305520675065474,0.987666149132147,0.350281683881924,3.49175337999684e-06,2.15756122025405e-09,0.626319467418567,0.00105642143894792,7.5585546121387e-07,1,"PWY-7791: UMP biosynthesis III"
"PWY-7851: coenzyme A biosynthesis II (eukaryotic)",-8.02320088336867,0.840043192197451,-10.1321331804289,17.7323049381562,1.00227024848961,18.9910680569571,0.246871629825311,0.998120043298307,0.241980046310311,4.67274255261385e-07,4.38244857774077e-11,0.680056907329149,0.000159525266782113,1.59689348468348e-08,1,"PWY-7851: coenzyme A biosynthesis II (eukaryotic)"
"PWY-7883: anhydromuropeptides recycling II",-8.57026451687184,1.60463928211246,-5.44062447716153,8.08219818817552,1.9145232375635,4.32871192737152,1.33763795591614,1.906595571057,0.721347244587418,0.000198397652154979,0.00230154852438207,0.512318911244636,0.0520939913658844,0.288192317061328,1,"PWY-7883: anhydromuropeptides recycling II"
"PWY-7953: UDP-N-acetylmuramoyl-pentapeptide biosynthesis III (meso-diaminopimelate containing)",-8.18883642337415,0.844637014064668,-10.5244003362614,17.9402751934651,1.00775121783397,19.6868687781685,0.295549412534384,1.00357831701994,0.241140678422202,1.41291980995713e-05,1.18691559367298e-08,0.672724672877425,0.00407423687578565,4.07668582719258e-06,1,"PWY-7953: UDP-N-acetylmuramoyl-pentapeptide biosynthesis III (meso-diaminopimelate containing)"
"PWY-7977: L-methionine biosynthesis IV",-8.34246461580959,0.863007898802559,-10.4695203467173,17.135733124629,1.02966984223596,18.3565162023556,0.476332863132697,1.02540618068258,0.414317487214617,1.32622597102429e-06,1.03662177008187e-09,0.612063709231699,0.000425753879640929,3.6730213928201e-07,1,"PWY-7977: L-methionine biosynthesis IV"
"PWY-7992: superpathway of menaquinol-8 biosynthesis III",-8.71572838743176,1.40121132433701,-6.39912390502977,0.878286600253613,1.67180977749012,0.548808403493101,1.51070892509581,1.66488713998006,0.962872705116775,9.97717759055328e-05,0.582556140354751,0.43672179003611,0.0212654473787409,1,1,"PWY-7992: superpathway of menaquinol-8 biosynthesis III"
"PWY-8004: Entner-Doudoroff pathway I",-7.89118426669694,0.830785644534105,-10.1428525564644,16.3110781009606,0.99122490619873,17.879416283797,-0.134532946628085,0.987120437610885,-0.212048476333126,1.19158867494841e-06,8.04958462283865e-10,0.687430077122228,0.000390079279932263,2.84306103436372e-07,1,"PWY-8004: Entner-Doudoroff pathway I"
"PWY-801: homocysteine and cysteine interconversion",-8.11708454511673,0.843548096558377,-10.0625310484607,12.3822994247824,1.00645201128155,12.9780690729348,0.0532537838956329,1.00228449022791,0.0307685002068953,2.54757397287128e-07,1.36036034773204e-08,0.73039450042324,8.71392869276552e-05,4.72325069633106e-06,1,"PWY-801: homocysteine and cysteine interconversion"
"PWY-8073: lipid IVA biosynthesis (P. putida)",-7.91775397521187,0.864068208551114,-9.64725967535497,12.5486828891198,1.03093491637147,12.9480330673318,-0.117747277976164,1.02666601639337,-0.158833426749983,5.29557622962543e-07,9.41105698592039e-09,0.722008438574121,0.000180866095577856,3.29802762655863e-06,1,"PWY-8073: lipid IVA biosynthesis (P. putida)"
"PWY-8131: 5'-deoxyadenosine degradation II",-9.74169870238008,1.50879944077611,-6.60644582054072,3.15175339638592,1.80017504394252,1.82654211345472,3.45728562737164,1.79272087095486,1.99316784246346,2.94020752706226e-05,0.174179934334009,0.130045189614076,0.00909066596381232,0.990440475613305,0.984319473681405,"PWY-8131: 5'-deoxyadenosine degradation II"
"PWY-8178: pentose phosphate pathway (non-oxidative branch) II",-8.22840304068735,0.87689395211807,-10.0335410658692,15.6023349141166,1.04623753570261,16.1593072324448,0.499008771143968,1.04190527056898,0.478398044167003,1.0966330844242e-06,1.99963318870558e-08,0.596969150032979,0.00035838109946983,6.85226919615094e-06,1,"PWY-8178: pentose phosphate pathway (non-oxidative branch) II"
"PWY-8187: L-arginine degradation XIII (reductive Stickland reaction)",-7.95168787832752,0.846835256040334,-10.1914615483017,16.4736256375332,1.01037397884395,17.9838081275009,0.00639270307286631,1.00619021768923,-0.0064249959909229,2.38004278087234e-06,1.47149574662902e-09,0.750541513772021,0.000756257519217681,5.19801998640221e-07,1,"PWY-8187: L-arginine degradation XIII (reductive Stickland reaction)"
"PWY-821: superpathway of sulfur amino acid biosynthesis (Saccharomyces cerevisiae)",3.45061958487171,1.82139520174229,1.93072222502714,-6.61041555454595,2.17313852240461,-3.06228950991346,-3.09908368582523,2.16413998055355,-1.44648824544246,0.0838507205722498,0.00949245934116135,0.190694402849788,1,0.935179134468507,1,"PWY-821: superpathway of sulfur amino acid biosynthesis (Saccharomyces cerevisiae)"
